,Twitter Query: lang:es -filter:retweets -filter:replies @GobIzcalli,,,,,,,,,,,,,,,,,,,
19/04/2022 14:23,@izcalliciudadan,izcalliciudadano,"K @KarlaFiesco en Ensueños nos van a dejar sin parques, banquetas y calles. Todos empiezan, los dejan, ñse instalan, nadie los quita Urge orden @GobIzcalli",1516497858354110473,,https://pbs.twimg.com/media/FQuuvdFXoAARktf.jpg,,1,1,Twitter for Android,6425,390,33,,2/6/2012,México,"Red ciudadana que marca la diferencia entre Indignos e Indignados, como decía Galeano. No doy RT a insultos.",,,View
19/04/2022 13:08,@osgo2603,Oscar Gomez,"Que triste noticia, espero que nuestras autoridades municipales y estatales hagan algo @GobIzcalli @KarlaFiesco @izcaheroes @pizcalli @ RT @azucenau: Las ciudades con mayor percepción de inseguridad según el @INEGI_INFORMA : 🔴 Fresnillo 97.1% 🔴 Ciudad Obregón 94.1% 🔴 Zacatecas 91.7% 🔴 Cuautitlán Izcalli 89.5% 🔴 Irapuato 87.6% 🔴 Guadalajara 87.1% Las ciudades con menor percepción de inseguridad 👇🏻",1516478871406850048,https://twitter.com/azucenau/status/1516394400506593281,,,1,2,Twitter for Android,5,68,0,,5/5/2015,"Cuautitlán Izcalli, México",,,,View
19/04/2022 13:06,@AntonioCataro59,Antonio Estudillo.,Pero acá en @edomex @EdoMexAzul @PRI_EDOMEX @EdoMex__Morena @GobIzcalli @EdoMexAzul @GobAtizapan @Gob_Tlalne no les interesa. RT @Ecogranjero: La importancia de los árboles,1516478471647621127,https://twitter.com/Ecogranjero/status/1516461878289051650,https://pbs.twimg.com/media/FQuOCpGX0AgTEfi.jpg,,0,0,Twitter for Android,641,581,14,,6/28/2012,www.elpoderdelapalabra.com.mx,"Profesor de economía y practicante de aikido. Gusto por la literatura, jazz, rock progesivo. Y triatleta, ya qué.🏊🚴🏃",http://todo-esta-en-todo.webnode.mx,,View
19/04/2022 10:12,@izcaheroes,Izcaheroes 🇲🇽,Realizamos una encuesta donde 221 personas participaron y así opinaron de los primeros #100diasdegobierno de @KarlaFiesco en @GobIzcalli #izcalli #somosfuturo #edomex Aquí los resultados 👇👇 RT @izcaheroes: @KarlaFiesco @ErickCuencaG 100 días de la administración de Karla Leticia Fiesco... cómo calificarías estos días.,1516434519078977537,https://twitter.com/izcaheroes/status/1515906278459121664,,,0,0,Twitter for Android,6779,6053,52,,10/6/2012,"Cuautitlán Izcalli, México","Cuenta ciudadana dé denuncias, Creadores de la campaña #VecinoResponsable en Izcalli, desde 2018 dejamos de representar a la colonia Niños Héroes.",,,View
19/04/2022 09:34,@erasmodjmix,erasmo sa,Izcallinfierno se adjudicó una persona que solo le interesa ser artista....@izcaheroes @Ej_SanIsidro @GobIzcalli RT @0_leviatan: ¿Sicierto que usted más se la pasa tomándose fotos barriendo y piensa que eso ya es gobernar doñita @KarlaFiesco ?,1516425020691595274,"https://twitter.com/0_leviatan/status/1516104438900879360
https://twitter.com/KarlaFiesco/status/1516084858409336837",,,2,3,Twitter for Android,147,1984,0,,1/6/2015,,,,,View
19/04/2022 08:58,@ObservatorioM19,Observatorio Metropolitano,"#Encuesta #Izcalli Los 125 gobiernos municipales del #Edomex cumplieron sus primeros 100 días, por ello, ¿Cómo calificas la administración de @KarlaFiesco García en @GobIzcalli? @joannaftorres @AnaBalderasMx @PacoRojasDip @soypacosantos @JORGEGA90040118",1516415835115565056,https://www.facebook.com/100241631454173/posts/524333119045020/,https://pbs.twimg.com/media/FQtkKmzX0AIP3Y7.jpg,,0,0,Twitter for Android,325,931,5,,6/20/2020,"Cuautitlán Izcalli, México",Periodismo crítico en el Valle de México,,,View
19/04/2022 07:38,@BlastorSantilla,Blastor_Oficial,Buen día. Excelente martes! #EsElBlas 🔥🎤👊🏽 #Rap #HipHop @GobIzcalli #Spotify,1516395793447534597,https://youtu.be/mcZd9hdMONs,,,0,1,Twitter for iPhone,580,88,1,,10/4/2011,,"BLASTOR un mc y representante del hip hop méxicano,quien en sus letras plasma tematicas sociales y personales.",https://open.spotify.com/artist/0KWXFDWCPP2FWmaH0AJx6V?si=u6sI18DlRtKNDNLr0JhOwQ,,View
19/04/2022 01:06,@izcaheroes,Izcaheroes 🇲🇽,Les dejamos esto @GobIzcalli @KarlaFiesco #izcalli #edomex #somosfuturo RT @izcaheroes: @KarlaFiesco @ErickCuencaG 100 días de la administración de Karla Leticia Fiesco... cómo calificarías estos días.,1516297242893770756,https://twitter.com/izcaheroes/status/1515906278459121664,,,0,1,Twitter for Android,6778,6053,0,,10/6/2012,"Cuautitlán Izcalli, México","Cuenta ciudadana dé denuncias, Creadores de la campaña #VecinoResponsable en Izcalli, desde 2018 dejamos de representar a la colonia Niños Héroes.",,,View
18/04/2022 22:20,@JornadaEdomex,La Jornada Estado de México,"Ce tras en connato de enfrentamiento que tuvieron, en redes sociales han sufrido ataques y amenazas por parte del grupo de comerciantes de Cuautitlán @GobIzcalli.",1516255340945321990,https://lajornadaestadodemexico.com/copaci-axotlan-se-reunira-con-abasto-y-comercio-de-cuautitlan-izcalli/,,,0,0,Twitter Web App,2806,18,46,✅,9/15/2020,Toluca,"La Jornada inicia en el Estado de México una labor informativa, consecuente con los valores fundamentales de nuestro país.",https://lajornadaestadodemexico.com/,,View
18/04/2022 21:34,@tvmextv,TvMex,"#TvMexNoticias Más de 500 personas son parte de la segunda edición del festival de las buenas acciones ""Izcallimpio"" en conjunto con siemens gamesa @GobIzcalli @KarlaFiesco",1516243756995039242,,pic.twitter.com/xARUESmoCK,,8,8,Twitter for iPhone,1374,1977,10,,11/26/2013,México,"Canal Digital que produce contenido informativo, de orientación y entretenimiento. #LaTvDeHoy",http://www.tvmex.tv,,View
18/04/2022 17:32,@MAPIMO2,MAPIMO2,"Ccp @KarlaFiesco @GobIzcalli @SPublicaIzcalli Y así cuidan los Angelitos del modulo ubicado sobre Avenida La Quebrada esquina con Calle de La Luz , Col. La Quebrada. Esto se ha reportado varias veces , pero al parecer nadie puede ni quiere poner orden a estos tipos. R. T.",1516182786218115077,,https://pbs.twimg.com/media/FQqQMc7VgAAQDlR.jpg,,0,0,Twitter for Android,2276,2266,39,,12/28/2014,,,,,View
18/04/2022 14:09,@luis_journalist,LUIS ROCHA / Política y Estilo,"Alcaldesa @KarlaFiesco, lo que hace el regidor @christianquin_m es formidable, al tiempo de hacer eficiente el trabajo edilicio. En Izcalli, hay miles de luminarias inservibles que dejó el morenista, @RicardoNAyala1 / @GobIzcalli @MAGPilloni RT @christianquin_m: Si en tu comunidad hay alguna #luminaria fundida, mándame un mensaje de #whatsapp, e iremos a repararla.",1516131844043186179,"https://twitter.com/christianquin_m/status/1516121887654531077
https://bit.ly/ChristianQuintanaWhatsapp",https://pbs.twimg.com/media/FQQR11iVcAMl6s_.jpg,,1,1,Twitter Web App,5525,4686,66,,7/25/2009,Edomex,"#Edomex Le voy al Cruz Azul / Periodista / Crítico / Ácido / No me soportan los corruptos / La Luna, mi fuente de poder, inspiración y energía.",https://www.luisrochanoticias.com/,,View
18/04/2022 12:09,@AntonioCataro59,Antonio Estudillo.,Por favor. @GobIzcalli @Edomex @EdoMexAzul @MorenajeIzcalli @PRI_EDOMEX @Morena_Izcalli @SEMOV_Edomex RT @ElOjodCiclovias: Todo el cochecentrismo en CDMX,1516101601424945154,https://twitter.com/ElOjodCiclovias/status/1516045585563926536,https://pbs.twimg.com/media/FQoTbOPX0AI5Wvi.jpg,,0,0,Twitter for Android,641,581,14,,6/28/2012,www.elpoderdelapalabra.com.mx,"Profesor de economía y practicante de aikido. Gusto por la literatura, jazz, rock progesivo. Y triatleta, ya qué.🏊🚴🏃",http://todo-esta-en-todo.webnode.mx,,View
17/04/2022 20:02,@jazmin2k,Jazmin,"Gracias @GobIzcalli Los invitamos a darle like y compartir, estaremos aún los siguientes 2 Domingos de abril pronto haré saber nuevas fechas y espacios. Gracias a los encargados del parque porq los espacios están muy limpios y bien cuidados.",1515858374839222272,,https://pbs.twimg.com/media/FQlpGgqXMAEiGkF.jpg,,0,0,Twitter Web App,397,344,0,,9/21/2013,México,Om Sat Chit Ananda Parabrahma,,,View
17/04/2022 09:58,@AntonioCataro59,Antonio Estudillo.,"Así en @GobIzcalli y en @Edomex por la gracia de las constructoras y un mal, pésimo diseño urbano. Otros cómplices que HOY se volvieron ecologistas @PRI_EDOMEX @PRICDMX_ @AccionNacional @EdoMexAzul @PRDMexico RT @CPByCXochimilco: ""No le llamen calor, llámenlo deforestación"". Mario Hernández. #yoprotejoelhumedal",1515706352693350400,https://twitter.com/CPByCXochimilco/status/1515494058248097798,https://pbs.twimg.com/media/FQgdzn_X0AEnqqJ.jpg,,0,0,Twitter for Android,642,581,14,,6/28/2012,www.elpoderdelapalabra.com.mx,"Profesor de economía y practicante de aikido. Gusto por la literatura, jazz, rock progesivo. Y triatleta, ya qué.🏊🚴🏃",http://todo-esta-en-todo.webnode.mx,,View
17/04/2022 08:06,@Ej_SanIsidro,Ejidal San Isidro,#DenunciaCiudadana Buenos días. Te comparto como amanece la Unidad Niños Héroes @izcaheroes Favor de atender @GobIzcalli @KarlaFiesco,1515678141083267077,,https://pbs.twimg.com/media/FQjEHtRXIAAjUmX.jpg,,0,0,Twitter Web App,550,742,4,,5/2/2019,"Cuautitlán Izcalli, México",#PresaElÁngulo #PlanDeGuadalupe2 #EjidalSanIsidro #VillasDelSol #LosPajaros #AmpliaciónEjidalSanIsidro #Antares #Gaviotas #Mariposas #Huertas #izcalli,,,View
16/04/2022 20:43,@AntonioCataro59,Antonio Estudillo.,Aquí lo dejo de tarea. @Edomex @alfredodelmazo @SEMOV_Edomex @GobIzcalli @Gob_Tlalne @GobAtizapan @KarlaFiesco,1515506211659005960,https://www.instagram.com/reels/audio/529012235260808/,,,0,0,Twitter for Android,640,580,14,,6/28/2012,www.elpoderdelapalabra.com.mx,"Profesor de economía y practicante de aikido. Gusto por la literatura, jazz, rock progesivo. Y triatleta, ya qué.🏊🚴🏃",http://todo-esta-en-todo.webnode.mx,,View
16/04/2022 16:43,@ErickCuencaG,Erick F. Cuenca Gurrola,"#100DíasDeGestión | @KarlaFiesco, @GobIzcalli reconocemos las acciones que desde su gobierno efectúa en favor de los #mexiquenses. ¡Sigamos trabajando por #ElEdoMexQueMerecemos!",1515445679350444032,,https://pbs.twimg.com/media/FQeoqkdXMAQAAqn.jpg,,0,1,TweetDeck,375,181,1,,1/18/2019,México,Trabajo por un mejor futuro para todas y para todos. Presidente @CoparmexMetro y CEO #RangerSwatMéxico. Unidos crecemos juntos y logramos más.,http://www.coparmexmetropolitano.mx,,View
16/04/2022 14:08,@VisionUrbanaMX,Visión Urbana,"Cuautitlán #Izcalli En el operativo participan elementos de Seguridad, Protección Civil y Bomberos  @GobIzcalli @KarlaFiesco",1515406783279378433,https://vision-urbana.com.mx/operativo-semana-santa-recorre-las-calles-de-cuautitlan-izcalli/,,,0,0,TweetDeck,5792,5868,41,,5/28/2010,Valle de México,Información y Noticias del Valle de México. Síguenos en Facebook https://www.facebook.com/VisionUrbanaMX,http://www.vision-urbana.com.mx,,View
16/04/2022 08:36,@izcaheroes,Izcaheroes 🇲🇽,"Deberían de de poner orden y qué realmente la procuraduría condominal actúe @KarlaFiesco @GobIzcalli con este tipo de vecinos. #izcalli RT @melrosnew: @izcaheroes @Ej_SanIsidro @SegCIzcalli @KarlaFiesco saben si existe algo que impida que la gente a parte de adueñarse de áreas verdes como parte de su casa , pasadas de la media noche dejen su escándalo.y eso va hasta el amanecer, y escuchar su concierto es una cosa barbara .",1515323230839574533,https://twitter.com/melrosnew/status/1515198567241207808,https://pbs.twimg.com/media/FQcRESLXIAIFzoW.jpg,,2,0,Twitter for Android,6771,6053,52,,10/6/2012,"Cuautitlán Izcalli, México","Cuenta ciudadana dé denuncias, Creadores de la campaña #VecinoResponsable en Izcalli, desde 2018 dejamos de representar a la colonia Niños Héroes.",,,View
15/04/2022 20:46,@AntonioCataro59,Antonio Estudillo.,De tarea @Edomex @SEMOV_Edomex @GobIzcalli RT @AllenCowgill: This is what good bike infrastructure for all ages looks like. My 5 yr old son & I brought up the tail end of the Alexis Bounds Memorial Bikeway inaugural ride last weekend. This is the 1st time I’ve felt comfortable taking him on a street. Good infrastructure is empowering.,1515144583176331276,https://twitter.com/AllenCowgill/status/1514964521630285828,pic.twitter.com/Dhx2RY2jkX,,0,0,Twitter for Android,640,580,14,,6/28/2012,www.elpoderdelapalabra.com.mx,"Profesor de economía y practicante de aikido. Gusto por la literatura, jazz, rock progesivo. Y triatleta, ya qué.🏊🚴🏃",http://todo-esta-en-todo.webnode.mx,,View
15/04/2022 16:50,@merakstar,MERAKSTAR,"Este delincuente te anda rondando por San Antonio, La Piedad y Lomas de Cuautitlán, el miércoles lo sorprendieron tratando de entrar a una casa en la madrugada y se reportó, anda cazando y solo prometen que van a mandar unidades @izcaheroes @GobIzcalli @KarlaFiesco",1515085092842049547,,https://pbs.twimg.com/media/FQap3F6XoA8IFR2.jpg,,1,0,Twitter for iPhone,50,132,0,,3/16/2011,"Cuautitlán Izcalli, México",Desafortunadamente...abominación,,,View
15/04/2022 12:09,@ContinuamosMX,Continuamos Mx,GOBIERNO DE CUAUTITLÁN IZCALLI PONE EN MARCHA OPERATIVO SEMANA SANTA 2022  #Izcalli #CuautitlánIzcalli #SeguridadCiudadana #SemanaSanta @KarlaFiesco @GobIzcalli,1515014578182127617,https://continuamos.mx/?p=35753,,,0,0,Twitter for iPhone,10725,8958,78,,12/27/2010,México,Diario digital; Periodismo libre/plural #Edomex #CDMX c/ Ediciones impresas; en Facebook ContinuamosMx Edición Digital en http://issuu.com/ContinuamosMx,http://www.continuamos.mx,,View
15/04/2022 11:56,@Ever_muav,Ever,Listo para iniciar viernes santo en Tepojaco @GobIzcalli vamos bien 👍🏻,1515011102890938374,,https://pbs.twimg.com/media/FQZmkDaWUAkUA_C.jpg,,0,0,Twitter for iPhone,19,38,0,,9/15/2021,,Si me conoces puedes ódiame o simplemente ser mi mejor amigo,,,View
15/04/2022 11:08,@ArturoOscoy,Arturo Contreras,Despliegan Operativo de Semana Santa en #Izcalli El @GobIzcalli realizará estas acciones 👇🏽,1514999179885613056,https://el-corresponsal.com/despliegan-operativo-de-semana-santa-en-izcalli/,,,0,0,Twitter for Android,196,774,2,,7/30/2012,Edomex,Trabajando en lo que más me gusta.,http://www.el-corresponsal.com,,View
14/04/2022 23:52,@zeruch124,Señor Don Licenciado Aguilar,"Bueno, ya va a ser media hora que llamé para pedir patrulla A ver a qué hora @GobIzcalli 🙄🙄🙄",1514829081472286728,,,,0,1,Twitter for Android,810,456,16,,11/13/2009,méxico,"Diseñador, hago fantasy cuando hay tiempo e inspiración. información de libretas personalizadas aquí, buen precio 😌 #miasanmia ⭐⭐⭐⭐⭐",http://zeruchdesign.com,,View
14/04/2022 21:01,@Factorcambio1,Diario Factor de Cambio,IMPLEMENTA CUAUTITLÁN IZCALLI “OPERATIVO SEMANA SANTA 2022” #cuautitlanizcalli #seguridad #semanasanta @GobIzcalli @KarlaFiesco @mizcalli @SPublicaIzcalli @FESC_UNAM @CuautitlanMX,1514785928304156677,https://factordecambio.net/implementa-cuautitlan-izcalli-operativo-semana-santa-2022/,,,0,1,Twitter Web App,370,743,1,,7/17/2019,Estado de México,Noticias del #Edomex y de #México La información correcta en el momento preciso. #Soyfactordecambio,https://factordecambio.net,,View
14/04/2022 19:02,@revista_pendulo,péndulo_revista,"Cuautitlán Izcalli, activa operativo “Semana Santa”.  @GobIzcalli",1514756014028992535,https://www.pendulonline.com/cuautitlan-izcalli-activa-operativo-semana-santa/,https://pbs.twimg.com/media/FQV-kTaXwAcotJu.jpg,,0,0,Twitter for Android,1483,739,7,,2/23/2010,México,Cuenta Oficial de la Revista Péndulo.,http://www.pendulonline.com,,View
14/04/2022 16:29,@tvmextv,TvMex,Elementos de la Comisaría General de Seguridad Ciudadana de Cuautitlán Izcalli lograron recuperar un vehículo el cual acababa de ser robado y detuvieron a un masculino señalado por su presunta participación en el delito cometido en Santa María las Torres. @GobIzcalli,1514717499077677059,,https://pbs.twimg.com/media/FQVbh_bXsAADRGN.jpg,,4,4,Twitter for iPhone,1372,1973,10,,11/26/2013,México,"Canal Digital que produce contenido informativo, de orientación y entretenimiento. #LaTvDeHoy",http://www.tvmex.tv,,View
14/04/2022 11:27,@ArturoOscoy,Arturo Contreras,#Seguridad Detienen a dos personas por robo en #Izcalli Policías del @GobIzcalli participaron en las capturas 👇🏽,1514641459168784384,https://el-corresponsal.com/detienen-a-dos-personas-por-robo-de-auto-y-a-casa-en-izcalli/,,,1,2,Twitter for Android,196,774,2,,7/30/2012,Edomex,Trabajando en lo que más me gusta.,http://www.el-corresponsal.com,,View
14/04/2022 09:18,@luis_journalist,LUIS ROCHA / Política y Estilo,"Daniel Serrano Palacios, pide a @GobIzcalli explicaciones en los temas de seguridad, recolección de basura, comercio y distribución de agua potable. (VIDEO)  / #CuautitlanIzcalli @daniel_ser @KarlaFiesco @MAGPilloni @XochitlZagalMX @AgustinVaMx",1514609017863041037,https://www.luisrochanoticias.com/post/daniel-serrano-palacios-critica-los-100-d%C3%ADas-de-gobierno-en-cuautitl%C3%A1n-Izcalli,,,0,0,Twitter for Android,5521,4682,66,,7/25/2009,Edomex,"#Edomex Cruz Azul ⚽ periodista 👊🏻 crítico 🤬, ácido 👽, no me soportan los políticos corruptos 🤣. La Luna 🌛 es mi fuente de poder y energía.",http://www.luisrochanoticias.com,,View
13/04/2022 19:58,@JornadaEdomex,La Jornada Estado de México,"Fue localizado el cuerpo sin vida de una persona en la colonia Infonavit Norte, en Cuautitlán Izcalli, Estado de México @GobIzcalli",1514407737395924999,https://lajornadaestadodemexico.com/localizan-cuerpo-sin-vida-en-infonavit-norte-en-cuautitlan-izcalli/,,,0,0,Twitter for Android,2795,18,47,✅,9/15/2020,Toluca,"La Jornada inicia en el Estado de México una labor informativa, consecuente con los valores fundamentales de nuestro país.",https://lajornadaestadodemexico.com/,,View
13/04/2022 16:03,@izcaheroes,Izcaheroes 🇲🇽,Cómo comenzaron los @GobIzcalli a realizar los trabajos de bacheo a principios de año....como aplican el bacheo unos meses después... #izcalli,1514348608392466433,,https://pbs.twimg.com/media/FQQMCAkWQAksaeJ.jpg,,0,1,Twitter for Android,6764,6053,52,,10/6/2012,"Cuautitlán Izcalli, México","Cuenta ciudadana dé denuncias, Creadores de la campaña #VecinoResponsable en Izcalli, desde 2018 dejamos de representar a la colonia Niños Héroes.",,,View
13/04/2022 10:03,@hola_atizapan,hola_atizapan,"""Paskinero News"" Parte 3 Deuda millonaria en @AtizapanZSAPASA, Operativo vacaciones seguras en @HuixquiGob que gobierna @RominaCDV Los Policías de @Gob_Tlalne tendrán que hacer #Zumba para bajar de peso @KarlaFiesco de @GobIzcalli nadamás bachea y bachea y sigue la #Inseguridad",1514257880521842688,,pic.twitter.com/p3rU5GPx57,,0,0,Twitter for Android,20565,40,66,,6/18/2013,"Tu voz , es nuestra voz!",El portal Informativo de Atizapán de Zaragoza y el Estado de Mexico,https://www.hola-atizapan.com,,View
13/04/2022 10:01,@hola_atizapan,hola_atizapan,"""Paskinero News"" Parte 2 Deuda millonaria en @AtizapanZSAPASA, Operativo vacaciones seguras en @HuixquiGob que gobierna @RominaCDV Los Policías de @Gob_Tlalne tendrán que hacer #Zumba para bajar de peso @KarlaFiesco de @GobIzcalli nadamás bachea y bachea y sigue la #Inseguridad",1514257407123365890,,pic.twitter.com/XQdMROdpRk,,0,1,Twitter for Android,20565,40,66,,6/18/2013,"Tu voz , es nuestra voz!",El portal Informativo de Atizapán de Zaragoza y el Estado de Mexico,https://www.hola-atizapan.com,,View
13/04/2022 09:59,@hola_atizapan,hola_atizapan,"""Paskinero News"" Parte 1 Deuda millonaria en @AtizapanZSAPASA, Operativo vacaciones seguras en @HuixquiGob que gobierna @RominaCDV Los Policías de @Gob_Tlalne tendrán que hacer #Zumba para bajar de peso @KarlaFiesco de @GobIzcalli nadamás bachea y bachea y sigue la #Inseguridad",1514256891286896647,,pic.twitter.com/UscnL3RTe2,,0,2,Twitter for Android,20565,40,66,,6/18/2013,"Tu voz , es nuestra voz!",El portal Informativo de Atizapán de Zaragoza y el Estado de Mexico,https://www.hola-atizapan.com,,View
12/04/2022 16:11,@Jedimx76,Jedimx,"Cada vez el @dominosmx de @GobIzcalli sucursal Jiménez Cantú, está peor. Ya las papitas ahora hasta sin papel encerado y ni queso.",1513988192147578880,,https://pbs.twimg.com/media/FQLEPNwWQAYgEHJ.jpg,,0,0,Twitter for Android,165,138,7,,5/5/2011,19°25′58″N 99°08′00″W,El décimo hombre. Veritas odium parit,,,View
12/04/2022 09:53,@Haparq2,Haparq2,"Hay mucho ratero en #Izcalli y los polecías municipales 🚓 ausentes, durmiendo, comiendo tacos o extorsionando a los ciudadanos. Cuando vas a actuar en contra de la inseguridad @KarlaFiesco? @GobIzcalli RT @PuntoMedioEdo: ⚠️📢🚨 Pareja fue despojada de su auto y sus pertenencias sobre Av. Hidalgo en Cuautitlán #Izcalli; los hechos quedaron grabados por un vecino, quien quiere alertar a la gente.",1513892964354904074,https://twitter.com/puntomedioedo/status/1513883127491538950,pic.twitter.com/58PEaX56P2,,0,0,Twitter for iPhone,810,1057,3,,3/17/2014,Cuautitlán Izcalli Edo. de Méx,Asociación Civil de Residentes de Hacienda del Parque 2a Sección. Trabajamos para convertir nuestro fraccionamiento en Un Lugar Mejor para Vivir.,http://www.haparq2.org,,View
11/04/2022 22:06,@Andrss11,@ndres,"@Operagua2019 @GobIzcalli : MÁS DE 20 AÑOS SIN AGUA, NO PODEMOS ESPERAR MÁS - ¡Firma la petición!  vía @Change_Mex",1513715213484363785,https://chng.it/6WxJrDDL,,,0,0,Twitter for Android,91,253,0,,9/16/2012,,,,,View
11/04/2022 21:58,@Andrss11,@ndres,"@Operagua2019 @GobIzcalli : MÁS DE 20 AÑOS SIN AGUA, NO PODEMOS ESPERAR MÁS - ¡Firma la petición!  vía @Change_Mex",1513713206342131714,https://chng.it/x4w8wQtG,,,0,0,Twitter for Android,91,253,0,,9/16/2012,,,,,View
11/04/2022 21:00,@adriangatillo,El Michi de Izcalli (en bici) 🐈🚴🏻💫🔥,"Hace unos minutos me lleve un susto terrible 🥺 entre @GobTepotzotlan y @GobIzcalli, por fortuna agarre la costumbre de traer reflejantes extra, a cambio solo les pedí permiso de 🎥 Atn @SEMOV_Edomex Automovilista, regálame 2 min de tu tiempo o x lo menos ve los últimos 10 seg",1513698534666735619,,pic.twitter.com/UdKvQ2GaPS,,1,7,Twitter for iPhone,1290,993,15,,3/29/2011,Infonavit Cuautitlan Izcalli N,"Soy lo mejor de lo peor, lo + caro de la barata, Intelectual y analfabeta, Algo de números, algo de letras... Soy donde vengo y a donde voy 🏳️‍🌈😻🐈🚴📸✈️🏎️",,,View
11/04/2022 20:38,@mariatteMx,Mariatte Mx.,"@Operagua2019 @GobIzcalli : MÁS DE 20 AÑOS SIN AGUA, NO PODEMOS ESPERAR MÁS - ¡Firma la petición!  a través de @Change_Mex",1513692993684918272,https://chng.it/KdsLWN9H,,,0,0,Twitter Web App,1193,1542,7,,3/25/2012,"mexico, df","Gracias por ls 15 Millones d votos para que yo termine mi mandato, los AMO DESAFORADAMENTE !! #Amlover #Cardiología, Amor, #ClimaSolar, #ActividadSismica #UNAM",,,View
11/04/2022 15:38,@ArturoOscoy,Arturo Contreras,"Recogieron 40 toneladas de basura en jornada de limpieza ""Izcallimpio"" Así fue la 2da edición de esta iniciativa promovida por el @GobIzcalli 👇🏽",1513617556980084742,https://el-corresponsal.com/recogieron-40-toneladas-de-basura-en-jornada-de-limpieza-izcallimpio/,,,0,0,Twitter for Android,196,773,2,,7/30/2012,Edomex,Trabajando en lo que más me gusta.,http://www.el-corresponsal.com,,View
11/04/2022 11:40,@ContinuamosMX,Continuamos Mx,MÁS DE 500 PERSONAS SON PARTE DE LA SEGUNDA EDICIÓN DEL FESTIVAL DE LAS BUENAS ACCIONES “IZCALLIMPIO” EN CONJUNTO CON SIEMENS GAMESA  #IzcalliLimpio #Izcalli #CuautitlanIzcalli @KarlaFiesco @GobIzcalli,1513557650365108228,https://continuamos.mx/?p=35620,,,0,0,Twitter for iPhone,10724,8957,78,,12/27/2010,México,Diario digital; Periodismo libre/plural #Edomex #CDMX c/ Ediciones impresas; en Facebook ContinuamosMx Edición Digital en http://issuu.com/ContinuamosMx,http://www.continuamos.mx,,View
10/04/2022 18:03,@VisionUrbanaMX,Visión Urbana,"Cuautitlán #Izcalli Cuarenta toneladas de basura fueron recolectadas gracias al trabajo en equipo de Gobierno, empresarios y vecinos  @GobIzcalli @KarlaFiesco",1513291550381334529,https://vision-urbana.com.mx/con-gran-participacion-culmina-segunda-edicion-del-festival-de-las-buenas-acciones-izcallimpio/,,,0,0,TweetDeck,5793,5867,41,,5/28/2010,Valle de México,Información y Noticias del Valle de México. Síguenos en Facebook https://www.facebook.com/VisionUrbanaMX,http://www.vision-urbana.com.mx,,View
10/04/2022 15:36,@12Parrafo,Párrafo 12/24,"La alcaldesa de @GobIzcalli , personal de Siemens Gamesa, rabajadores del Ayuntamiento y vecinos, participaron en el segundo Festival de las Buenas Acciones “Izcallimpio”, donde se realizaron trabajos de limpia en inmediaciones del Lago de Guadalupe.",1513254617412481037,https://m.facebook.com/story.php?story_fbid=364601842345324&id=100063865320724,https://pbs.twimg.com/media/FQAnDZtWQAU_IbY.jpg,,0,0,Twitter Web App,247,157,0,,10/1/2017,,,,,View
10/04/2022 13:43,@revista_pendulo,péndulo_revista,"Con gran afluencia se llevó a cabo en Izcalli, la segunda edición del “festival de las buenas acciones”.  @GobIzcalli",1513226296481882114,https://www.pendulonline.com/con-gran-afluencia-se-llevo-a-cabo-en-izcalli-la-segunda-edicion-del-festival-de-las-buenas-acciones/,,,0,0,Twitter for Android,1483,738,7,,2/23/2010,México,Cuenta Oficial de la Revista Péndulo.,http://www.pendulonline.com,,View
10/04/2022 13:06,@izcalliciudadan,izcalliciudadano,"Exactamente el día de votaciones, la alcalde de Cuautitlán Izcalli con oca a todo el personal del ayuntamiento a una jornada de limpieza. Esa gente no podrá participar en la #ConsultaPopular 😒 @KarlaFiesco @GobIzcalli RT @KarlaFiesco: Con gran participación ciudadana llevamos a cabo el Festival de las Buenas Acciones ""Izcallimpio II"" en Bosques del Lago. Agradezco a todas y todos por su participación para hacer de #Izcalli un mejor lugar para todos.",1513216813932457989,https://twitter.com/KarlaFiesco/status/1513215545973301250,pic.twitter.com/67e8WIfYKS,,0,0,Twitter for Android,6415,389,34,,2/6/2012,México,"Red ciudadana que marca la diferencia entre Indignos e Indignados, como decía Galeano. No doy RT a insultos.",,,View
