,Twitter Query: lang:es -filter:retweets -filter:replies @GobIzcalli,,,,,,,,,,,,,,,,,,,
Date,Screen Name,Full Name,Tweet Text,Tweet ID,Link(s),Media,Location,Retweets,Favorites,App,Followers,Follows,Listed,Verfied,User Since,Location,Bio,Website,Timezone,Profile Image
23/05/2022 18:39,@JornadaEdomex,La Jornada Estado de México,"Un hombre sufrió una descarga eléctrica y quedó colgado de poste en avenida Primero de Mayo esquina Teotihuacán, en @GobIzcalli.",1528883423619624960,https://lajornadaestadodemexico.com/se-electrocuta-un-trabajador-que-maniobraba-cables-en-cuautitlan-izcalli/,,,0,0,Twitter for Android,3018,17,49,✅,9/15/2020,Toluca,"La Jornada inicia en el Estado de México una labor informativa, consecuente con los valores fundamentales de nuestro país.",https://lajornadaestadodemexico.com/,,View
23/05/2022 17:00,@JornadaEdomex,La Jornada Estado de México,"Los empresarios mexiquenses se reunieron con la presidenta municipal de Cuautitlán @GobIzcalli, @KarlaFiesco, para exponerle los problemas que enfrentan.",1528858310048305152,https://lajornadaestadodemexico.com/el-cceem-se-reune-con-alcaldes-para-rehabilitacion-de-parques-industriales/,,,0,0,Twitter Web App,3017,17,49,✅,9/15/2020,Toluca,"La Jornada inicia en el Estado de México una labor informativa, consecuente con los valores fundamentales de nuestro país.",https://lajornadaestadodemexico.com/,,View
23/05/2022 15:45,@Ej_SanIsidro,Ejidal San Isidro,"Personal de @GobIzcalli llevo a cabo la limpieza de calles y áreas verdes en Ampliación Ejidal San Isidro, también pintaron los juegos y cancha de basquetbol.",1528839477719867393,,https://pbs.twimg.com/media/FTeGvx7WYAcek5n.jpg,,0,0,Twitter Web App,579,803,4,,5/2/2019,"Cuautitlán Izcalli, México",#PresaElÁngulo #PlanDeGuadalupe2 #EjidalSanIsidro #VillasDelSol #LosPajaros #AmpliaciónEjidalSanIsidro #Antares #Gaviotas #Mariposas #Huertas #izcalli,,,View
23/05/2022 14:43,@NuestraZona_,@NuestraZona,#NZinforma Draga presa El Ángulo personal de @GobAtizapan @CaemEdomex e @GobIzcalli encabezados por alcalde @Pedro_RVillegas. Previenen inundaciones en ambos municipios . . . #AtizapánDeZaragoza #CuautitlanIzcallititlán #Edomex,1528823978999037960,http://nuestra-zona.com/limpian-presa-el-angulo-para-evitar-inundaciones-en-atizapan/,,,0,0,Twitter Web App,841,2040,9,,10/17/2016,Estado de México,Medio de información multimedia del Valle de México,http://www.nuestra-zona.com,,View
23/05/2022 14:37,@paafl,Paaf ☾,"La guerra por el #agua ha comenzado; ayer hubo enfrentamiento entre colonias por falta de agua y luz en @GobIzcalli @mizcalli @CaemEdomex @OperaguaIzcalli e intervinieron soldados, buscando a alguien entre los edificios de mi UH #cuidaelagua",1528822478927175680,,pic.twitter.com/NkOOBaK8q3,,0,0,Twitter Web App,291,989,1,,7/5/2013,CDMX,"Diseñadora, me rio fuerte, amo la luna y el café. No soy normal. IG: soypaaf",http://facebook.com/paafl,,View
23/05/2022 11:52,@revistatyt,revistatyt,El gobierno municipal de Cuautitlán Izcalli coordina acciones con la Sedena y GN para combatir los altos índices de robo al autotransporte. @GobIzcalli @KarlaFiesco #RoboAutotransporte,1528780905187356672,https://bit.ly/3Gdzeha,,,0,0,TweetDeck,19603,1127,120,,6/27/2009,Tel. +525553621501,Revista TRANSPORTES Y TURISMO. El mejor medio informativo sobre la industria automotriz de vehículos pesados y el sector autotransporte de carga y pasaje en MX.,http://www.tyt.com.mx,,View
23/05/2022 10:15,@AMXNoticias,Agencia Mexiquense de Noticias,"#AMxVial 🚧 || #CuautitlánIzcalli: debido a los trabajos de bacheo que se realizan en la Av. 1 de Mayo, a la altura de la EPO 11, la vialidad se encuentra parcialmente cerrada. ⚠️ Extreme Precauciones. Vía @GobIzcalli #AgenciaMxNoticias",1528756449995792384,,https://pbs.twimg.com/media/FTc4s4kWYAAgiXI.jpg,,1,1,Twitter Web App,91919,674,332,✅,4/11/2012,Estado de México,"Somos el sistema de #Noticias de @MexiquenseR y @MexiquenseTV. Llevamos hasta ti lo más importante del #Edoméx, #México 🇲🇽 y el Mundo 🌎 Canal 34.2 📺",https://radioytvmexiquense.mx/index.php/noticias/,,View
23/05/2022 05:17,@Biciverde,BiciVerde Mx 💚,#BoletinDePrensa Nueva Ley de Movilidad cambiará leyes estatales y creará Sistema Nacional por la seguridad vial #Izcalli #EdoMex @Legismex @GobIzcalli @Edomex LEER:,1528681578007773184,http://disq.us/t/47uymrh,https://pbs.twimg.com/media/FTb3ykZWQAAt10n.jpg,,0,0,Twitter for iPhone,14340,4687,228,,2/20/2010,México,"Pedaleamos hacia un futuro mejor, únete y generemos el cambio. @biciredmx @cicloviascra Premio Estatal de Medio Ambiente 2012 / http://t.me/biciverde",https://linktr.ee/BiciVerde,,View
22/05/2022 19:05,@ObservatorioM19,Observatorio Metropolitano,"#Manifestación #Izcalli #Edomex Vecinos de #InfonavitCentro se manifiestan en av José Ma. Morelos en ambos sentidos hacen un llamado a las autoridades del @GobIzcalli y @CFEmx ya que llevan más de 24 horas sin luz debido a una falla, que según estaría arreglada en 4 horas.",1528527579824676864,,https://pbs.twimg.com/media/FTZrumSXEAEePmB.jpg,,0,1,Twitter for Android,413,964,5,,6/20/2020,"Cuautitlán Izcalli, México",Periodismo crítico en el Valle de México,,,View
22/05/2022 18:11,@AntonioCataro59,Antonio Estudillo.,¿Y luego? ¡Ah! Es que las inmobiliarias @Edomex @SEMOV_Edomex @SaludEdomex @alfredodelmazo @GobIzcalli @Gob_Tlalne @GobAtizapan @EdoMexAzul @Morena_edomex @PRI_EDOMEX RT @Mexteki:,1528513835262480386,https://twitter.com/Mexteki/status/1528414732205494272,https://pbs.twimg.com/media/FTYFFW4WUAAWVG7.jpg,,0,0,Twitter for Android,645,594,14,,6/28/2012,www.elpoderdelapalabra.com.mx,"Profesor de economía y practicante de aikido. Gusto por la literatura, jazz, rock progesivo. Y triatleta, ya qué.🏊🚴🏃",http://todo-esta-en-todo.webnode.mx,,View
22/05/2022 17:34,@AntonioCataro59,Antonio Estudillo.,"Es que los dueños del transporte @Edomex @alfredodelmazo @EdoMexAzul @Morena_edomex @PRI_EDOMEX @SEMOV_Edomex @Gob_Tlalne @GobAtizapan @GobIzcalli RT @Yunker_Bikes03: Yo si quiero que la CDMX sea como Ámsterdam. Pero les encanta el auto, el tráfico, contingencias ambientales, pocas áreas verdes, sobretodo poner pretextos en la no inversión al transporte.",1528504627964088320,https://twitter.com/Yunker_Bikes03/status/1528403519811854337,,,0,0,Twitter for Android,645,594,14,,6/28/2012,www.elpoderdelapalabra.com.mx,"Profesor de economía y practicante de aikido. Gusto por la literatura, jazz, rock progesivo. Y triatleta, ya qué.🏊🚴🏃",http://todo-esta-en-todo.webnode.mx,,View
22/05/2022 15:49,@georgerueda05,Jorge Antonio Rueda,"En @GobIzcalli en el fraccionamiento San Antonio, hoy 2/05/22 el agua llega con tierra y se hace el reporte a @OperaguaIzcalli wstan contaminando millones de lts de agua.@KarlaFiesco @peta @greenpeacemx @Edomex @lopezobrador_ @PROFEPA_Mx @conagua_mx @propaem_sma @ecologistas",1528478084562812928,,,,0,0,Twitter for Android,1,8,0,,4/16/2022,,"Abogado litigante, miembro de asociaciones civiles y ong, comer y ver películas 🌟",,,View
21/05/2022 18:34,@ContinuamosMX,Continuamos Mx,LES CORTAN EL AGUA A COLONIAS DE CUAUTITLÁN IZCALLI  #Emergencia #Agua #Izcalli @KarlaFiesco @GobIzcalli,1528157289558859776,https://continuamos.mx/?p=36787,,,0,0,Twitter Web App,10722,8951,78,,12/27/2010,México,Diario digital; Periodismo libre/plural #Edomex #CDMX c/ Ediciones impresas; en Facebook ContinuamosMx,http://www.continuamos.mx,,View
21/05/2022 09:59,@Soymrls,Abraham,"Oye @INMUDECI_22 @GobIzcalli me puedes decir porque esta persona nos cobra $10 por ""estacionamiento"" en el gimnasio Pablo Colin a las personas que venimos a entrenar? Solo cercó con rafia, sin identificación alguna y mucho menos sin dar comprobante de tesorería.",1528027708789252103,,https://pbs.twimg.com/media/FTSlF5KUEAAlWhY.jpg,,0,0,Twitter for Android,163,269,0,,4/22/2010,"México, México",,,,View
20/05/2022 21:51,@Jedimx76,Jedimx,"Y ustedes vecinos, ¿Cuántos días se quedan sin agua desde que empezó la administración de @KarlaFiesco en @GobIzcalli?",1527844382543683586,,,,0,0,Twitter for Android,163,137,7,,5/5/2011,19°25′58″N 99°08′00″W,El décimo hombre. Veritas odium parit,,,View
20/05/2022 18:59,@ContinuamosMX,Continuamos Mx,TOMA PROTESTA EL NUEVO CRONISTA MUNICIPAL DE CUAUTITLÁN IZCALLI  @KarlaFiesco @GobIzcalli #Cultura #historia,1527801125784543232,https://continuamos.mx/?p=36722,,,0,0,Twitter Web App,10722,8949,78,,12/27/2010,México,Diario digital; Periodismo libre/plural #Edomex #CDMX c/ Ediciones impresas; en Facebook ContinuamosMx,http://www.continuamos.mx,,View
20/05/2022 16:24,@ContinuamosMX,Continuamos Mx,INICIAN JORNADA DE SALUD BUCAL EN 25 ESCUELAS DE CUAUTITLÁN IZCALLI  #Salud #Izcalli @KarlaFiesco @GobIzcalli,1527762267898408960,https://continuamos.mx/?p=36691,,,0,0,Twitter for iPhone,10722,8949,78,,12/27/2010,México,Diario digital; Periodismo libre/plural #Edomex #CDMX c/ Ediciones impresas; en Facebook ContinuamosMx,http://www.continuamos.mx,,View
20/05/2022 14:05,@VisionUrbanaMX,Visión Urbana,Cuautitlán #Izcalli Gobierno de Izcalli ofrece mayores facilidades para regularizar a usuarios en el pago de agua  @GobIzcalli @KarlaFiesco,1527727105454198784,https://vision-urbana.com.mx/gobierno-de-izcalli-ofrece-mayores-facilidades-para-regularizar-a-usuarios-en-el-pago-de-agua/,,,0,0,TweetDeck,5796,5864,40,,5/28/2010,Valle de México,Información y Noticias del Valle de México. Síguenos en Facebook https://www.facebook.com/VisionUrbanaMX,http://www.vision-urbana.com.mx,,View
20/05/2022 12:00,@Ej_SanIsidro,Ejidal San Isidro,"#DenunciaCiudadana 🛑 “Tengan cuidado en una Cherokee roja están robando en casa habitacion en tepojaco y alrededores, fuimos víctimas de estas personas a 2 calles de los Arcos de Tepojaco“ Favor de revisar y atender @GobIzcalli @SPublicaIzcalli @C5Edomex @SS_Edomex #Izcalli",1527695650867097602,,https://pbs.twimg.com/media/FTNq0jtXwAAPm_E.jpg,,1,1,Twitter Web App,577,793,4,,5/2/2019,"Cuautitlán Izcalli, México",#PresaElÁngulo #PlanDeGuadalupe2 #EjidalSanIsidro #VillasDelSol #LosPajaros #AmpliaciónEjidalSanIsidro #Antares #Gaviotas #Mariposas #Huertas #izcalli,,,View
20/05/2022 11:35,@Ej_SanIsidro,Ejidal San Isidro,#DenunciaCiudadana 💧 En la colonia Bsques de Morelos conocido el hoyo. Ya tiene varios días que se desperdicia mucha agua sobre la calle Tejocotes. Se reportó a @OperaguaIzcalli pero no han acudido. Favor de atender @GobIzcalli @KarlaFiesco #Edomex #Izcalli,1527689357586444288,,https://pbs.twimg.com/media/FTNshwnXwAUA7YK.jpg,,0,0,Twitter Web App,577,793,4,,5/2/2019,"Cuautitlán Izcalli, México",#PresaElÁngulo #PlanDeGuadalupe2 #EjidalSanIsidro #VillasDelSol #LosPajaros #AmpliaciónEjidalSanIsidro #Antares #Gaviotas #Mariposas #Huertas #izcalli,,,View
19/05/2022 23:26,@INDUSTRIALESMX_,INDUSTRIALES MX®,Directiva de #INDUSTRIALESMX acompañaron a @LauraGlezEDOMEX Presidenta del @ConsejoCCEM a importante reunión con @KarlaFiesco titular del @GobIzcalli quien escuchó atentamente inquietudes y propuestas del sector productivo para sumar esfuerzos por este gran municipio del #EdoMéx,1527506114308448259,,https://pbs.twimg.com/media/FTLKtn6XoAEWobr.jpg,,0,0,Twitter for Android,1552,3671,10,,2/27/2014,EdoMex CDMX Hgo Pue Tlax Qro,"Asociación de industriales y empresarios de libre afiliación, quiénes buscan representación activa, influyente y apoyo para la correcta operación de su empresa.",http://industrialesmx.org,,View
19/05/2022 22:07,@tvmextv,TvMex,#TvMexNoticias @KarlaFiesco se reúne con integrantes del Consejo Coordinador Empresarial del Estado de México @ConsejoCCEM @GobIzcalli,1527486147001196551,,pic.twitter.com/OJJO7Ph8lo,,2,3,Twitter for iPhone,1396,1979,10,,11/26/2013,México,"Canal Digital que produce contenido informativo, de orientación y entretenimiento. #LaTvDeHoy",http://www.tvmex.tv,,View
19/05/2022 20:24,@revista_pendulo,péndulo_revista,Alejandro Mondragón es nombrado nuevo cronista municipal de Cuautitlán Izcalli.  @GobIzcalli #Cultura,1527460228131966985,https://www.pendulonline.com/alejandro-mondragon-es-nombrado-nuevo-cronista-municipal-de-cuautitlan-izcalli/,,,0,0,Twitter for Android,1490,742,7,,2/23/2010,México,Cuenta Oficial de la Revista Péndulo.,http://www.pendulonline.com,,View
19/05/2022 19:52,@12Parrafo,Párrafo 12/24,"La alcaldesa de @GobIzcalli, @KarlaFiesco tomó protesta a Alejandro Mondragón Hernández como Cronista Municipal, quien se encargará de llevar el registro escrito del acontecer histórico local, para preservar y fomentar la identidad de los pobladores con su municipio y el Estado.",1527452153253617676,,https://pbs.twimg.com/media/FTKZRouWYA4GJsD.jpg,,0,0,Twitter Web App,255,157,3,,10/1/2017,,,,,View
19/05/2022 18:29,@JornadaEdomex,La Jornada Estado de México,"🔴 Solicitan ayuda para localizar a #FlorGuadalupe Esparragoza de 22 años, que fue vista por última vez en la Colonia Santa María Guadalupe Las Torres, Cuautitlán @GobIzcalli.🔍",1527431237102555136,https://lajornadaestadodemexico.com/padres-de-familia-de-flor-guadalupe-esparragoza-piden-ayuda-para-localizar/,https://pbs.twimg.com/media/FTKEo2SVsAIxLnN.jpg,,0,0,Twitter Web App,3003,17,49,✅,9/15/2020,Toluca,"La Jornada inicia en el Estado de México una labor informativa, consecuente con los valores fundamentales de nuestro país.",https://lajornadaestadodemexico.com/,,View
19/05/2022 18:09,@ArturoOscoy,Arturo Contreras,Impulsa gobierno de #Izcalli talento de emprendedores La información del @GobIzcalli 👇🏽,1527426339384721408,https://el-corresponsal.com/impulsa-gobierno-de-izcalli-talento-de-emprendedores/,,,0,0,Twitter for Android,196,775,2,,7/30/2012,Edomex,Trabajando en lo que más me gusta.,http://www.el-corresponsal.com,,View
19/05/2022 15:24,@Ej_SanIsidro,Ejidal San Isidro,"Alcaldes van y vienen mientras sigue en abandono los 3 semáforos del Cruce de Cuatro Caminos, Cuautitlán #Izcalli Vecinos han ingresado infinidad de escritos a @GobIzcalli y es fecha de que no se ve solución. Vía @RodrigoPerezTp #Edomex",1527384597780209664,https://fb.watch/d6a5jX2nTb/,,,0,0,Twitter Web App,576,790,4,,5/2/2019,"Cuautitlán Izcalli, México",#PresaElÁngulo #PlanDeGuadalupe2 #EjidalSanIsidro #VillasDelSol #LosPajaros #AmpliaciónEjidalSanIsidro #Antares #Gaviotas #Mariposas #Huertas #izcalli,,,View
19/05/2022 14:16,@sferaPolitica,Sfera Política,💼🍯 @GobIzcalli sede de la feria de emprendimiento,1527367498521161739,https://tinyurl.com/49abrtpu,,,0,0,TweetDeck,7151,1658,86,,11/5/2010,México,"La mejor información, rápida, veraz y confiable de lo que sucede en Acción Nacional http://facebook.com/SferaPolitica",http://www.sferapolitica.com,,View
19/05/2022 12:40,@AMXNoticias,Agencia Mexiquense de Noticias,"#AMxVial 🚧 || Debido a trabajos de bacheo, encontrará congestionada la vialidad en el Circuito Bosques de Bolognia, a la altura de la Glorieta de Cisnes, en #CuautitlánIzcalli. ⚠️ Tome previsiones. Vía @GobIzcalli #AgenciaMxNoticias",1527343490275094535,,https://pbs.twimg.com/media/FTI059WVUAgu77K.jpg,,0,0,Twitter Web App,91871,674,329,✅,4/11/2012,Estado de México,"Somos el sistema de #Noticias de @MexiquenseR y @MexiquenseTV. Llevamos hasta ti lo más importante del #Edoméx, #México 🇲🇽 y el Mundo 🌎 Canal 34.2 📺",https://radioytvmexiquense.mx/index.php/noticias/,,View
18/05/2022 22:10,@den_025,Denisse Garcia,"✨ La mejor forma de crecer, es tomando las oportunidades que se te presentan ✨ 👏🏼 Feria de emprendimiento 👏🏼 🤝 Trabajo en equipo @GobIzcalli @SedecoEdomex @IM_Emprendedor 🤝",1527124530921185280,,https://pbs.twimg.com/media/FTFvqV6WIAE2a3D.jpg,,0,0,Twitter for iPhone,831,238,0,,5/14/2012,Estado de Mexico,🤝 Unidad de Atención Empresarial del Gobierno municipal de #Izcalli 🦁 Club de Leones #Izcalli,,,View
18/05/2022 21:48,@tvmextv,TvMex,"#TvMexNoticias Cuautitlán Izcalli, sede de la feria de emprendimiento @GobIzcalli @KarlaFiesco @SedecoEdomex @pabloperaltag",1527118905654841346,,pic.twitter.com/8pO77mEBT7,,4,5,Twitter for iPhone,1395,1980,10,,11/26/2013,México,"Canal Digital que produce contenido informativo, de orientación y entretenimiento. #LaTvDeHoy",http://www.tvmex.tv,,View
18/05/2022 17:40,@Jedimx76,Jedimx,Y ahora un Tsuru embestido por tráiler rumbo al sur a la altura del circuito en carriles centrales @Edomex @GobIzcalli,1527056628381532161,,,,0,0,Twitter for Android,162,136,7,,5/5/2011,19°25′58″N 99°08′00″W,El décimo hombre. Veritas odium parit,,,View
18/05/2022 15:52,@MorralArturo,Arturo Del Morral 💤,"Soy médico general recién egresado. Estos días he estado en busca de trabajo, en @gobizcalli por calentar la sillame quieren pagar $1,500 /hora más bisnes. #izcalli",1527029446783512576,,,,0,0,Twitter for Android,160,307,0,,1/19/2022,"Las Vegas, NV",Cuenta afiliada al gobierno Ruso 💻 Doctor paracetamolero y grillero 💉💉 #somosfuturo #izcalli,,,View
18/05/2022 15:27,@Jedimx76,Jedimx,"El tramo de la autopista Mexico-Queretaro desde Lago de Guadalupe hasta la Ford de @GobIzcalli y viceversa, ya se debería llamar ""el pedazo del diablo"" Dos motociclistas atropellados hoy, sin contar otros accidentes ocurridos",1527023184356294656,,,,3,5,Twitter for Android,162,136,7,,5/5/2011,19°25′58″N 99°08′00″W,El décimo hombre. Veritas odium parit,,,View
18/05/2022 15:24,@Jedimx76,Jedimx,"Mucha paciencia a los usuarios de la Mexico-Queretaro a la altura de @GobIzcalli, antes de llegar a la Ford. Motociclista derrapa y muere atropellado por tráiler en la lateral, esto, pasando el entronque del Circuito Mexiquense, rumbo al norte.",1527022348829966336,,,,0,1,Twitter for Android,162,136,7,,5/5/2011,19°25′58″N 99°08′00″W,El décimo hombre. Veritas odium parit,,,View
18/05/2022 15:08,@SedecoEdomex,Secretaría de Desarrollo Económico del GEM,"La Feria de Emprendimiento “Conexión Emprendedora” en #CuautitlánIzcalli, ¡fue todo un éxito! Juntos sigamos impulsando el desarrollo económico del #Edoméx. @Edomex @GobIzcalli @IM_Emprendedor @pabloperaltag @anahyravi @KarlaFiesco #EmprendeEdoméx #SedecoEdoméx",1527018380443717633,,pic.twitter.com/gxMYahYqQx,,1,1,Twitter for iPhone,13857,354,57,✅,11/14/2013,Estado de México,Secretaría de Desarrollo Económico del Gobierno del Estado de México.,https://desarrolloeconomico.edomex.gob.mx,,View
18/05/2022 12:59,@EnfasisComunica,Énfasis Comunica,"¡LUCHANDO POR EL DOWN! El día 17 de Junio en punto de las 7:00 pm, se llevará a cabo un evento de lucha libre internacional, en el Gimnasio Pablo Colín, Cuautitlán Izcalli. Parte de la recaudación de los boletos se donará para los niños con Síndrome de Down. @GobIzcalli",1526985736838340608,,https://pbs.twimg.com/media/FTDxamfXoAIzzfQ.jpg,,0,0,Twitter for iPhone,3069,1991,37,,11/1/2010,Cuautitlán Izcalli,"Medio de comunicación, prensa, radio http://enfasiscomunicaciones.com",http://enfasiscomunicaciones.com,,View
18/05/2022 12:41,@EnfasisComunica,Énfasis Comunica,"El secretario @pabloperaltag de la @SedecoEdomex reconoció el trabajo que ha realizado la presidenta @KarlaFiesco del @GobIzcalli por el compromiso, el trabajo con la inversión y la generación de empleos para los izcallenses.",1526981270152089600,,https://pbs.twimg.com/media/FTDtUm3WYAAyNYY.jpg,,0,1,Twitter Web App,3069,1991,37,,11/1/2010,Cuautitlán Izcalli,"Medio de comunicación, prensa, radio http://enfasiscomunicaciones.com",http://enfasiscomunicaciones.com,,View
18/05/2022 12:25,@iWheelLoveU,iWheelLoveU,"Un país que que no garantiza ni el 10% de vialidades accesibles, no debería de presumirse inclusivo. Ilustración de Ángel Boligán @SeGobCDMX @SRE_mx @AuditorioMx @GobCDMX @Edomex @GobIzcalli",1526977315929997314,,pic.twitter.com/QNkWjGnfVM,,3,1,Twitter for iPhone,13,18,0,,4/20/2022,,"Somos Alex y Tania, una pareja de locos creativos que avanzan acompañados de una silla de ruedas para ilustrar y visibilizar la discapacidad.",,,View
18/05/2022 09:07,@SedecoEdomex,Secretaría de Desarrollo Económico del GEM,"🚀|| Nos vemos hoy en la “Feria de Emprendimiento #ConexiónEmprendedora"", a las 9:00 horas en #CuautitlánIzcalli. ¡Conecta tu emprendimiento y llévalo al siguiente nivel! @GobIzcalli @IM_Emprendedor #EmprenderEsEdoméx",1526927571207827462,,https://pbs.twimg.com/media/FTC8iDRWAAUoBB6.jpg,,1,2,Twitter for iPhone,13856,354,57,✅,11/14/2013,Estado de México,Secretaría de Desarrollo Económico del Gobierno del Estado de México.,https://desarrolloeconomico.edomex.gob.mx,,View
18/05/2022 08:55,@merakstar,MERAKSTAR,"Desde ayer a las 14:00 hrs nos quedamos sin luz en Col La Piedad y Centro Urbano La Piedad, debido a eso no se contó con energía para bombear agua y no hay energía para los refrigerados. De que se trata? @izcaheroes @GobIzcalli @KarlaFiesco @CFEmx",1526924497357520896,,,,0,0,Twitter for iPhone,53,138,0,,3/16/2011,"Cuautitlán Izcalli, México",Desafortunadamente...abominación,,,View
18/05/2022 08:20,@IM_Emprendedor,IME,"#ComunidadEmprendedora 🙋🏻‍♀️✨🙋🏻‍♂️ ¡Es hoy, es hoy! 🚀 Conecta tu emprendimiento y llévalo al siguiente nivel en nuestra “Feria de Emprendimiento #ConexiónEmprendedora” en 📍 #CuautitlánIzcalli. Más información en 🌐  @GobIzcalli #EmprendeEdoméx #IMEinforma",1526915507433066498,https://pymedigital.mx,https://pbs.twimg.com/media/FTArsAlUEAE6Qhy.jpg,,0,0,Twitter Web App,9574,255,44,,5/9/2014,"Toluca, Estado de México","El Instituto Mexiquense del Emprendedor es un organismo público descentralizado, dependiente de la Secretaría de Desarrollo Económico del Estado de México.",https://ime.edomex.gob.mx,,View
17/05/2022 18:00,@sferaPolitica,Sfera Política,#Izcalli #ProtecciónCivil @GobIzcalli sofoca incendio en parque industrial,1526699081963388929,https://tinyurl.com/2ez769xt,,,0,0,TweetDeck,7155,1658,87,,11/5/2010,México,"La mejor información, rápida, veraz y confiable de lo que sucede en Acción Nacional http://facebook.com/SferaPolitica",http://www.sferapolitica.com,,View
17/05/2022 17:03,@IM_Emprendedor,IME,"#ComunidadEmprendedora🙋🏻‍♀️✨🙋🏻‍♂️ Conecta tu emprendimiento este 📆 18 de mayo de 2022 y llévalo al siguiente nivel, sé parte de la “Feria de Emprendimiento #ConexiónEmprendedora”📍sede #CuautitlánIzcalli. Más información en:  @GobIzcalli #EmprenderEsEdoméx",1526684737456046080,https://pymedigital.mx,https://pbs.twimg.com/media/FS51XPvUcAAnzwt.jpg,,0,0,Twitter Web App,9575,255,44,,5/9/2014,"Toluca, Estado de México","El Instituto Mexiquense del Emprendedor es un organismo público descentralizado, dependiente de la Secretaría de Desarrollo Económico del Estado de México.",https://ime.edomex.gob.mx,,View
17/05/2022 16:01,@ContinuamosMX,Continuamos Mx,GOBIERNO DE CUAUTITLÁN IZCALLI SOFOCA INCENDIO EN PARQUE INDUSTRIAL  #Izcalli #CuautitlánIzcalli @KarlaFiesco @GobIzcalli,1526669365264908288,https://continuamos.mx/?p=36636,,,0,0,Twitter for iPhone,10718,8947,78,,12/27/2010,México,Diario digital; Periodismo libre/plural #Edomex #CDMX c/ Ediciones impresas; en Facebook ContinuamosMx,http://www.continuamos.mx,,View
17/05/2022 10:40,@IM_Emprendedor,IME,"#ComunidadEmprendedora🙋🏻‍♀️✨🙋🏻‍♂️ Conecta tu emprendimiento este 📆 18 de mayo de 2022 y llévalo al siguiente nivel, sé parte de la “Feria de Emprendimiento #ConexiónEmprendedora”📍sede #CuautitlánIzcalli. Más información en:  @GobIzcalli #EmprenderEsEdoméx",1526588352585244673,https://pymedigital.mx,https://pbs.twimg.com/media/FS51PEZUYAEsjwb.jpg,,0,0,Twitter Web App,9571,255,44,,5/9/2014,"Toluca, Estado de México","El Instituto Mexiquense del Emprendedor es un organismo público descentralizado, dependiente de la Secretaría de Desarrollo Económico del Estado de México.",https://ime.edomex.gob.mx,,View
17/05/2022 09:12,@ObservatorioM19,Observatorio Metropolitano,Los @DipMorenaEdomex exigen que acaben #hospitalesabandonados de @GobTepotzotlan y @GobIzcalli @JORGEGA90040118 @mcruz0609 ccp @joannaftorres @AnaBalderasMx @soypacosantos @PacoRojasDip #Tepotzotlán #Izcalli,1526566446549110786,,,,0,1,Twitter for Android,392,958,5,,6/20/2020,"Cuautitlán Izcalli, México",Periodismo crítico en el Valle de México,,,View
16/05/2022 22:52,@EltrinarNoticia,El Trinar Noticias,Gobierno de Cuautitlán Izcalli sofoca incendio en parque industrial  @EltrinarNoticia #ArcoNorte @RicardoNAyala1 #CuautitlánIzcalli @GobIzcalli @KarlaFiesco #CuautitlánIzcalli,1526410262286282752,http://www.eltrinar.com.mx/gobierno-de-cuautitlan-izcalli-sofoca-incendio-en-parque-industrial/,https://pbs.twimg.com/media/FS7k3AOVIAAr-Xw.jpg,,0,0,Twitter Web App,254,1070,3,,4/21/2017,,Sitio web de noticias y medios de comunicación,http://www.eltrinar.com.mx,,View
16/05/2022 21:49,@tvmextv,TvMex,#TvMexNoticias Festejaron con gran éxito a Mamás Izcallenses @GobIzcalli @KarlaFiesco,1526394391333568515,,pic.twitter.com/ZTdF0Zr1e3,,5,5,Twitter for iPhone,1394,1980,10,,11/26/2013,México,"Canal Digital que produce contenido informativo, de orientación y entretenimiento. #LaTvDeHoy",http://www.tvmex.tv,,View
16/05/2022 18:41,@JornadaEdomex,La Jornada Estado de México,"El hospital general en Cuautitlán @GobIzcalli está en un 70 por ciento de avance y se encuentra en obra negra, sin ningún tipo de equipamiento.",1526347110026604544,https://lajornadaestadodemexico.com/urge-se-concluya-el-hospital-general-de-cuautitlan-izcalli-morena/,,,0,1,Twitter Web App,2984,17,49,✅,9/15/2020,Toluca,"La Jornada inicia en el Estado de México una labor informativa, consecuente con los valores fundamentales de nuestro país.",https://lajornadaestadodemexico.com/,,View
