,Twitter Query: lang:es -filter:retweets -filter:replies @GobIzcalli,,,,,,,,,,,,,,,,,,,
26/04/2022 20:18,@NDP_Noticias,NDP Noticias,"El @GobIzcalli, que preside @KarlaFiesco, convoca a mujeres y hombres que cuenten con vocación de servicio para participar en el proceso de reclutamiento y selección 2022, para incorporarse como: Policía Municipal. #MásInformación 👇",1519123724452220934,http://ndpnoticias.com/?p=2741,https://pbs.twimg.com/media/FRUC-aWXwAQ-zk_.jpg,,0,0,Twitter for iPhone,1629,1861,4,,3/28/2017,"Atizapán de Zaragoza, México",,https://ndpnoticias.com,,View
26/04/2022 15:15,@ArturoOscoy,Arturo Contreras,Abren convocatoria para incorporar nuevos policías a #Izcalli @GobIzcalli 👇🏽,1519047525927473160,https://el-corresponsal.com/abren-convocatoria-para-incorporar-nuevos-policias-a-izcalli/,,,0,0,Twitter for Android,196,775,2,,7/30/2012,Edomex,Trabajando en lo que más me gusta.,http://www.el-corresponsal.com,,View
26/04/2022 15:15,@Ej_SanIsidro,Ejidal San Isidro,"#DenunciaCiudadana 💧 Fuga de agua sobre la calle Aguascalientes casi esquina Morelos, junto al tope y a la guarnición esto es en la Col. Luis Echeverria. Favor de atender @OperaguaIzcalli @GobIzcalli #izcalli #Edomex",1519047412244955137,,https://pbs.twimg.com/media/FRSSts_XoAM2bkZ.jpg,,0,0,Twitter Web App,557,754,4,,5/2/2019,"Cuautitlán Izcalli, México",#PresaElÁngulo #PlanDeGuadalupe2 #EjidalSanIsidro #VillasDelSol #LosPajaros #AmpliaciónEjidalSanIsidro #Antares #Gaviotas #Mariposas #Huertas #izcalli,,,View
26/04/2022 14:49,@ContinuamosMX,Continuamos Mx,CAPTURAN A PRESUNTA BANDA DE ROBO DE VEHÍCULOS EN IZCALLI  #Izcalli #CuautitlanIzcalli #Delincuencia #SeguridadCiudadana @KarlaFiesco @GobIzcalli,1519040939863396353,https://continuamos.mx/?p=36065,,,1,1,Twitter for iPhone,10722,8954,78,,12/27/2010,México,Diario digital; Periodismo libre/plural #Edomex #CDMX c/ Ediciones impresas; en Facebook ContinuamosMx Edición Digital en http://issuu.com/ContinuamosMx,http://www.continuamos.mx,,View
26/04/2022 14:46,@ContinuamosMX,Continuamos Mx,"BOMBEROS DE IZCALLI RESCATAN VEHÍCULO, DEL RÍO CUAUTITLÁN  #Izcalli #CuautitlanIzcalli @KarlaFiesco @GobIzcalli",1519040175837392896,https://continuamos.mx/?p=36053,,,0,0,Twitter for iPhone,10722,8954,78,,12/27/2010,México,Diario digital; Periodismo libre/plural #Edomex #CDMX c/ Ediciones impresas; en Facebook ContinuamosMx Edición Digital en http://issuu.com/ContinuamosMx,http://www.continuamos.mx,,View
26/04/2022 14:45,@revista_pendulo,péndulo_revista,Convocan a mujeres y hombres que cuenten con vocación de servicio a formar parte de la Policía Municipal de Cuautitlán Izcalli  @GobIzcalli,1519039892541501440,https://www.pendulonline.com/convocan-a-mujeres-y-hombres-que-cuenten-con-vocacion-de-servicio-a-formar-parte-de-la-policia-municipal-de-cuautitlan-izcalli/,,,0,0,Twitter for Android,1485,740,7,,2/23/2010,México,Cuenta Oficial de la Revista Péndulo.,http://www.pendulonline.com,,View
26/04/2022 14:00,@sferaPolitica,Sfera Política,👧🎉 @GobIzcalli FESTEJARÁ A LAS NIÑAS Y NIÑOS IZCALLENSES CON MAGNO EVENTO: “CIUDAD FUTURO”,1519028545095233536,https://tinyurl.com/yc3tfyfz,,,0,0,TweetDeck,7151,1661,86,,11/5/2010,México,"La mejor información, rápida, veraz y confiable de lo que sucede en Acción Nacional http://facebook.com/SferaPolitica",http://www.sferapolitica.com,,View
26/04/2022 12:57,@noticiazonacero,Zona Cero Noticias Edoméx,#ZCN | El @GobIzcalli abrió la convocatoria para la contratación de nuevos policías. Checa aquí la convocatoria. 👇🏻👮🏻‍♂️,1519012726680473601,,https://pbs.twimg.com/media/FRSeA1LVEAAehOm.jpg,,0,0,Twitter for Android,12222,445,63,,1/28/2013,Estado de México,Portal web con las noticias y los hechos más relevantes ocurridos en el norte del Estado de México.,http://www.zonaceronoticias.com.mx,,View
26/04/2022 09:59,@EnfasisComunica,Énfasis Comunica,"¿Eres mayor de 60 años? Ya puedes acudir por tu cuarta dosis 1ra dosis 2da dosis 3ra dosis 📌Tepojaco, DIF Calle Miguel Hidalgo, cerrada Lázaro Cárdenas ⏰8:00 am a 2:00 pm @GobIzcalli",1518968046630621185,,https://pbs.twimg.com/media/FRR1Yf9WYAAv-Lm.jpg,,0,0,Twitter for Android,3061,1991,37,,11/1/2010,Cuautitlán Izcalli,"Medio de comunicación, prensa, radio http://enfasiscomunicaciones.com",http://enfasiscomunicaciones.com,,View
26/04/2022 08:57,@FiascoKarla,Karla Fiasco,"Encontré este pájaro muerto en la entrada del @gobizcalli hoy por la mañana, inmediatamente tuve que ir con una bruja y salió tu cara @AlejandraDMV en una vaso con agua. Tú me estás arruinando mi gobierno #izcalli #somosfuturo",1518952431886950401,,https://pbs.twimg.com/media/FRRnL9FXMAEm5uq.jpg,,1,1,Twitter for Android,331,501,1,,1/18/2022,Chipitongo el alto.,...La presidenta municipal..... Karla María Nicolasa Fiasco para servirle a Dios y Axel García.,,,View
26/04/2022 06:49,@noticiazonacero,Zona Cero Noticias Edoméx,#ZCN | El @GobIzcalli te invita a festejar a lo grande el Día del Niño en la Ciudad Futuro que se instalará en la explanada del Palacio Municipal los días 29 y 30 de abril.,1518920138577170432,,https://pbs.twimg.com/media/FRRJ0NpX0AA5otQ.jpg,,0,0,Twitter for Android,12221,445,63,,1/28/2013,Estado de México,Portal web con las noticias y los hechos más relevantes ocurridos en el norte del Estado de México.,http://www.zonaceronoticias.com.mx,,View
25/04/2022 21:56,@Ej_SanIsidro,Ejidal San Isidro,#DenunciaCiudadana 🛑 Llévanos más de una hora entre Cisnes rumbo a Tepojaco y ninguna patrulla de tránsito. Favor de atender @GobIzcalli @SPublicaIzcalli @C5Edomex @SS_Edomex #izcalli #Edomex,1518785969943625730,,https://pbs.twimg.com/media/FRPPZDTWQAgJWoE.jpg,,1,1,Twitter Web App,556,754,4,,5/2/2019,"Cuautitlán Izcalli, México",#PresaElÁngulo #PlanDeGuadalupe2 #EjidalSanIsidro #VillasDelSol #LosPajaros #AmpliaciónEjidalSanIsidro #Antares #Gaviotas #Mariposas #Huertas #izcalli,,,View
25/04/2022 21:47,@EnfasisComunica,Énfasis Comunica,"Elementos de la policía de @GobIzcalli detuvieron a dos presuntos delicuentes luego de robar dos vehículos de @Coppel Luego del aseguramiento, fueron trasladados a la Fiscalía General de Justicia de robo a transporte en Atizapán, donde se determinará su situación jurídica",1518783673721442304,,https://pbs.twimg.com/media/FRPNsuOXoAAHXk6.jpg,,1,1,Twitter for Android,3061,1991,37,,11/1/2010,Cuautitlán Izcalli,"Medio de comunicación, prensa, radio http://enfasiscomunicaciones.com",http://enfasiscomunicaciones.com,,View
25/04/2022 21:42,@12Parrafo,Párrafo 12/24,"🔴#AVISO | Elementos de Seguridad Pública de @GobIzcalli detuvieron a dos sujetos por su presunta participación en el robo de dos vehículos de la empresa con razón social COPPEL, ubicada en la avenida Doctor Jiménez Cantú en la colonia Rincón Colonial.",1518782569000620038,https://m.facebook.com/story.php?story_fbid=374517901353718&id=100063865320724,pic.twitter.com/INlp09OE7o,,0,0,Twitter for Android,248,157,3,,10/1/2017,,,,,View
25/04/2022 21:30,@tvmextv,TvMex,#TvMexNoticias Acercan programas de protección civil y seguridad a la población infantil de #CuautitlánIzcalli @KarlaFiesco @GobIzcalli,1518779606026829825,,pic.twitter.com/m64qOfZ8rZ,,5,5,Twitter for iPhone,1381,1979,10,,11/26/2013,México,"Canal Digital que produce contenido informativo, de orientación y entretenimiento. #LaTvDeHoy",http://www.tvmex.tv,,View
25/04/2022 20:01,@pizcalli,Periódico de Izcalli,👮🏽‍♀️👮🏻 Abre @GobIzcalli proceso de reclutamiento de policías en #Izcalli para mujeres y hombres que cuenten con vocación de servicio. Consulta las bases.  #SomosFuturo,1518757220355346437,https://www.cuautitlanizcalli.gob.mx/wp-content/uploads/pdf/convocatorias/2022/Convocatoria-policias.pdf,https://pbs.twimg.com/media/FRO1oiBXwAgKzYN.jpg,,0,1,Twitter for Android,12287,297,43,,12/21/2009,Cuautitlán Izcalli,"Nos posicionamos como un periódico confiable y efectivo entre nuestros lectores, manteniéndonos como el medio informativo líder de opinión en #CuautitlánIzcalli",http://www.periodicodeizcalli.com.mx,,View
25/04/2022 17:57,@MagieeSS,Maggie🦋♈🇲🇽,"Nunca eh entendido esto, se me hace, ""estúpida su logística"", sí ya fueron a cortar el pasto y/o apodar árboles, porqué fregados no se llevan la basura? Porqué la dejan ahí, hasta q les inche ir por la basura? Se me hace, trabajo doble O por gastar dinero?? @GobIzcalli ... RT @Albertozamora32: @DSPCIZCALLI @GobIzcalli @izcaheroes @izcalliciudadan Vinieron a cortar 3 árboles el día miércoles de la semana pasada, y no han venido por las ramas, a dónde hay que hablar? Esto es en Paseos de Izcalli, no se puede caminar por la banqueta.",1518725879232401409,https://twitter.com/Albertozamora32/status/1518655646379425792,https://pbs.twimg.com/media/FRNZQaHWYAIfZ6Z.jpg,,0,0,Twitter for Android,2352,1815,1,,6/17/2021,México,"Sé una buena persona en la vida real, no solo en redes sociales...✌🏻",,,View
25/04/2022 15:52,@Factorcambio1,Diario Factor de Cambio,GOBIERNO DE CUAUTITLÁN IZCALLI FESTEJARÁ A LAS NIÑAS Y NIÑOS CON MAGNO EVENTO: “CIUDAD FUTURO” #cuautitlanizcalli @FESC_UNAM @SPublicaIzcalli @GobIzcalli @KarlaFiesco @CuautitlanMX,1518694418651435008,https://factordecambio.net/gobierno-de-cuautitlan-izcalli-festejara-a-las-ninas-y-ninos-con-magno-evento-ciudad-futuro/,,,0,1,Twitter Web App,374,741,1,,7/17/2019,Estado de México,Noticias del #Edomex y de #México La información correcta en el momento preciso. #Soyfactordecambio,https://factordecambio.net,,View
25/04/2022 15:03,@ArturoOscoy,Arturo Contreras,"Acercan cultura de protección civil y seguridad a población infantil de #Izcalli @GobIzcalli promovió ""Un día con tu Policía"" y ""Bombero por un día""👇🏽",1518682145220227072,https://el-corresponsal.com/acercan-cultura-de-proteccion-civil-y-seguridad-a-poblacion-infantil-de-izcalli/,,,0,0,Twitter for Android,196,775,2,,7/30/2012,Edomex,Trabajando en lo que más me gusta.,http://www.el-corresponsal.com,,View
25/04/2022 14:56,@NDP_Noticias,NDP Noticias,"El @GobIzcalli, que encabeza @KarlaFiesco Karla Fiesco, celebrará el día Día del Niño con un magno evento de dos días llamado #CiudadFuturo donde los más pequeños del hogar podrán disfrutar de diferentes actividades. #MásInformación 👇",1518680300347437058,http://ndpnoticias.com/?p=2690,https://pbs.twimg.com/media/FRNvrxXXoAIcSMk.jpg,,0,0,Twitter for iPhone,1630,1863,4,,3/28/2017,"Atizapán de Zaragoza, México",,https://ndpnoticias.com,,View
25/04/2022 14:27,@revista_pendulo,péndulo_revista,Protección Civil y Bomberos de Izcalli junto a elementos de seguridad pública recuperan vehículo que cayó al Río Cuautitlán.  @GobIzcalli #ProteccionCivil,1518672984382357506,https://www.pendulonline.com/proteccion-civil-y-bomberos-junto-a-elementos-de-seguridad-publica-recuperan-vehiculo-que-cayo-al-rio-cuautitlan/,,,0,0,Twitter for Android,1485,740,7,,2/23/2010,México,Cuenta Oficial de la Revista Péndulo.,http://www.pendulonline.com,,View
25/04/2022 14:11,@pizcalli,Periódico de Izcalli,⚠🚔 Prepara @GobIzcalli compra de 100 patrullas en #Izcalli Información completa 👇,1518669127371702279,https://periodicodeizcalli.com/prepara-gobierno-municipal-compra-de-100-patrullas/,https://pbs.twimg.com/media/FRNlX-sWQAAR8jY.jpg,,0,0,Twitter Web App,12284,297,43,,12/21/2009,Cuautitlán Izcalli,"Nos posicionamos como un periódico confiable y efectivo entre nuestros lectores, manteniéndonos como el medio informativo líder de opinión en #CuautitlánIzcalli",http://www.periodicodeizcalli.com.mx,,View
25/04/2022 13:56,@P_Civil_Magazin,Protección Civil Magazín,"Acercan a niñas y niños a trabajo de bomberos, en Cuautitlán, Izcalli, Estado de México, con los programas “Bombero por un día” y “Un día con tu policía"".  @DDMexico #díadelniño @GobIzcalli",1518665368952348675,https://bit.ly/3KfeLcj,https://pbs.twimg.com/media/FRNhfimWQAA7I_F.jpg,,0,0,Twitter Web App,323,295,6,,5/15/2018,Ciudad de México,Espacio de comunicación y difusión sobre temas relacionados con la protección civil,,,View
25/04/2022 13:11,@12Parrafo,Párrafo 12/24,"🔴#ATENCION | La Coordinación de Protección Civil y Bomberos de @GobIzcalli realizó labores de recuperación de un vehículo marca Seat, modelo Córdoba color rojo, el cual se encontraba en el Río Cuautitlán a la altura de la colonia San Antonio.",1518653993001619462,https://m.facebook.com/story.php?story_fbid=374313058040869&id=100063865320724,https://pbs.twimg.com/media/FRNXEpHXIAIoXcO.jpg,,0,1,Twitter Web App,247,157,3,,10/1/2017,,,,,View
25/04/2022 13:00,@sferaPolitica,Sfera Política,👮🚓ACERCAN PROGRAMAS DE PROTECCIÓN CIVIL Y SEGURIDAD A LA POBLACIÓN INFANTIL @GobIzcalli,1518651054966992896,https://tinyurl.com/44v9dd58,,,0,0,TweetDeck,7153,1661,86,,11/5/2010,México,"La mejor información, rápida, veraz y confiable de lo que sucede en Acción Nacional http://facebook.com/SferaPolitica",http://www.sferapolitica.com,,View
24/04/2022 17:13,@ContinuamosMX,Continuamos Mx,ACERCAN PROGRAMAS DE PROTECCIÓN CIVIL Y SEGURIDAD A LA POBLACIÓN INFANTIL DE IZCALLI  #Izcalli #ProtecciónCivil #CuautitlanIzcalli @KarlaFiesco @GobIzcalli,1518352337559068675,https://continuamos.mx/?p=35995,,,0,0,Twitter for iPhone,10723,8958,78,,12/27/2010,México,Diario digital; Periodismo libre/plural #Edomex #CDMX c/ Ediciones impresas; en Facebook ContinuamosMx Edición Digital en http://issuu.com/ContinuamosMx,http://www.continuamos.mx,,View
24/04/2022 16:06,@VisionUrbanaMX,Visión Urbana,"Cuautitlán #Izcalli Niñas y niños izcallenses aprendieron y se divirtieron con las actividades del programa ""Bombero por Un Día"" 👇 @GobIzcalli @KarlaFiesco",1518335526331367425,,pic.twitter.com/h1Grx3kyPe,,0,0,TweetDeck,5794,5866,41,,5/28/2010,Valle de México,Información y Noticias del Valle de México. Síguenos en Facebook https://www.facebook.com/VisionUrbanaMX,http://www.vision-urbana.com.mx,,View
24/04/2022 07:36,@aguilarkarina,Karina Aguilar,"Atención!! @GobIzcalli esto es el pan de cada día y ni qué decir de los autos con placas foráneas, basta darse una vuelta por la autopista. RT @diario24horas: Un grupo de policías municipales fue captado intentando extorsionar a un camionero; detuvieron al conductor del tráiler alegando que el vehículo tenía reporte de robo.",1518207361990729733,"https://twitter.com/diario24horas/status/1517855655754969088
https://www.24-horas.mx/2022/04/23/policias-tratan-de-extorsionar-a-camionero-en-cuautitlan-izcalli/",,,1,0,Twitter for Android,1160,1022,10,,7/2/2010,,Ejerzo el periodismo con pasión total. Los comentarios en esta red social son a título personal.,,,View
23/04/2022 22:01,@Haparq2,Haparq2,"#Izcalli en el lugar 40 de los municipios con mayor población que usa silla de ruedas. En la mayoría de los calles, las aceras están invadidas, son intransitables o inexistentes. Y el número de usuarios en aumento. Que hacer @KarlaFiesco @GobIzcalli? 👵🏻👨🏽‍🦳♿️ #MovilidadAccesible RT @AlcaldesMexico: ➡ En este ranking te presentamos los municipios con mayor población con movilidad limitada. Accede al ranking completo en la #RevistaAlcaldesMx",1518062463903838208,"https://twitter.com/alcaldesmexico/status/1518005546908930048
http://bit.ly/3tXOURg",https://pbs.twimg.com/media/FQ_nhp2X0AEwSma.jpg,,1,1,Twitter for iPhone,816,1068,3,,3/17/2014,Cuautitlán Izcalli Edo. de Méx,Asociación Civil de Residentes de Hacienda del Parque 2a Sección. Trabajamos para convertir nuestro fraccionamiento en Un Lugar Mejor para Vivir.,http://www.haparq2.org,,View
23/04/2022 17:07,@NDP_Noticias,NDP Noticias,"En el marco de los festejos por el Día del Niño, el @GobIzcalli que encabeza @KarlaFiesco, llevó a cabo los programas “Bombero por un día” y “Un día con tu policía”, para impulsar la cultura de Protección Civil y en la población infantil del municipio.",1517988652764344332,https://www.ndpnoticias.com/?p=2668,,,0,0,Twitter for iPhone,1628,1862,4,,3/28/2017,"Atizapán de Zaragoza, México",,https://ndpnoticias.com,,View
23/04/2022 16:38,@EltrinarNoticia,El Trinar Noticias,"La alcaldesa Karla Fiesco García agradeció la presencia de niñas y niños, a quienes aseguró que su gobierno trabaja para cuidar y proteger a los más pequeños..  @RicardoNAyala1 #CuautitlánIzcalli @GobIzcalli @KarlaFiesco #CuautitlánIzcalli",1517981206381428738,https://youtu.be/sZgFFRh-VQE,,,0,0,Twitter Web App,245,1065,3,,4/21/2017,,Sitio web de noticias y medios de comunicación,http://www.eltrinar.com.mx,,View
23/04/2022 15:45,@Factorcambio1,Diario Factor de Cambio,ACERCAN PROGRAMAS DE PROTECCIÓN CIVIL Y SEGURIDAD A LA POBLACIÓN INFANTIL #cuautitlanizcalli @SPublicaIzcalli @FESC_UNAM @GobIzcalli @KarlaFiesco @DIFIzcalli2022 @CuautitlanMX,1517967938514468872,https://factordecambio.net/acercan-programas-de-proteccion-civil-y-seguridad-a-la-poblacion-infantil/,,,0,1,Twitter Web App,373,741,1,,7/17/2019,Estado de México,Noticias del #Edomex y de #México La información correcta en el momento preciso. #Soyfactordecambio,https://factordecambio.net,,View
23/04/2022 14:00,@sferaPolitica,Sfera Política,📃👩 NUEVOS NOMBRAMIENTOS EN LA ADMINISTRACIÓN MUNICIPAL @GobIzcalli,1517941381888724992,https://tinyurl.com/2p9dwcjz,,,0,0,TweetDeck,7153,1661,86,,11/5/2010,México,"La mejor información, rápida, veraz y confiable de lo que sucede en Acción Nacional http://facebook.com/SferaPolitica",http://www.sferapolitica.com,,View
23/04/2022 13:31,@AntonioCataro59,Antonio Estudillo.,Y las #constructoras junto con @Edomex @EdoMexAzul @alfredodelmazo @PRI_EDOMEX @Morena_edomex @GobIzcalli @SEMOV_Edomex Ahí la llevamos. RT @Steve_Cutts: Happy Earth Day! 🌍🌱,1517934103642865664,https://twitter.com/Steve_Cutts/status/1517578470221660160,https://pbs.twimg.com/media/FQ-FkhFWUAAMMws.jpg,,0,0,Twitter for Android,640,583,14,,6/28/2012,www.elpoderdelapalabra.com.mx,"Profesor de economía y practicante de aikido. Gusto por la literatura, jazz, rock progesivo. Y triatleta, ya qué.🏊🚴🏃",http://todo-esta-en-todo.webnode.mx,,View
23/04/2022 11:48,@Ignacio76308439,aeliusz22,"Con las autoridades ausentes, de fin de semana en algún destino turístico, los malos polis tienen fiesta; ""al cabo que ya son gobierno y a gusto"" @KarlaFiesco @GobIzcalli @SPublicaIzcalli RT @izcaheroes: Así la policía de @SPublicaIzcalli",1517908300989313024,"https://twitter.com/izcaheroes/status/1517307490358022144
https://twitter.com/leonor_zapien/status/1517306984743292928",,,1,1,Twitter for Android,14,230,2,,5/9/2020,,,,,View
23/04/2022 10:35,@EnfasisComunica,Énfasis Comunica,"UN DÍA CON TU POLICÍA EN IZCALLI 🚔 Aún estás a tiempo para acudir a vivir la experiencia de un día con tu policía🚔 en Av. San Juan Bautista, Lomas de #Cuautitlán. @GobIzcalli",1517889844759904262,,https://pbs.twimg.com/media/FRCgupLXEAISNY3.jpg,,0,0,Twitter for Android,3055,1990,37,,11/1/2010,Cuautitlán Izcalli,"Medio de comunicación, prensa, radio http://enfasiscomunicaciones.com",http://enfasiscomunicaciones.com,,View
23/04/2022 08:22,@Jedimx76,Jedimx,"Ayer me sentí discriminado en el @StarbucksMex de @GobIzcalli porque a las señoritas antes que su servidor, si les dieron su vaso y me dieron puro ajolote. Espero que no haya sido por ser negrito y chaparrito. Y no se vale decir que justo con ellas de acabaron.",1517856383244328960,,https://pbs.twimg.com/media/FRCCVZKXMAEYuUi.jpg,,0,0,Twitter for Android,164,138,7,,5/5/2011,19°25′58″N 99°08′00″W,El décimo hombre. Veritas odium parit,,,View
23/04/2022 02:16,@Ignacio76308439,aeliusz22,"Crea fama y échate a dormir; Autoridad municipal ausente ya llevan más de 100 días de gobierno, @GobIzcalli, @KarlaFiesco,",1517764416954986496,https://www.elsoldetoluca.com.mx/policiaca/cuautitlan-izcalli-el-municipio-mas-inseguro-del-edomex-inegi-8174171.html,,,1,0,Twitter for Android,14,230,2,,5/9/2020,,,,,View
22/04/2022 21:55,@Res_Boulevares,Res. Boulevares.,Es cuando entiendes porque en la más reciente encuesta de percepción de inseguridad @GobIzcalli figura entre los más inseguros del @edomex y si le sumas que sus elementos ejecutan a la gente que detienen como a este Octavio Ocaña… Miedo que te detengan esos tipos! RT @FernandoCruzFr7: ‼️POLICÍAS MUNICIPALES INTENTABAN EXTORSIONAR A CAMIONERO EN CUAUTITLÁN IZCALLI‼️ el operador del trailer no se dejó amedrentar cuando fue detenido sobre la México-Querétaro.,1517698765653741568,https://twitter.com/fernandocruzfr7/status/1517600506755137536,pic.twitter.com/PCizMFHh52,,1,1,Twitter for iPhone,4217,678,27,,3/10/2013,"Naucalpan, Estado de México. ","Fraccionamiento Residencial Boulevares. Información relevante sobre el Residencial, Municipio y algo más.",,,View
22/04/2022 19:38,@MonseAburto,Monserrat Aburto®,"Así no más, un hombre se instala en la Carr Méx- Cuautitlán a parar imprudentemente el tránsito para que la gente cruce; cuando el puente peatonal está a 100 ms. A cambio: unas monedas. ¿Quién pone orden a esto?@GobIzcalli @SPublicaIzcalli @CIzcalli_EdoMex @KarlaFiesco",1517664273962455040,,https://pbs.twimg.com/media/FQ_TnQfVgAACgYC.jpg,,0,0,Twitter for Android,220,220,1,,10/14/2010,"Cuautitlán Izcalli, México","Soy lo que fui, soy lo que soy y lo que pronto seré. Soy lo que los demás creen que soy. Soy lo que debo explicar en tres renglones de mi.",,,View
22/04/2022 16:40,@EnfasisComunica,Énfasis Comunica,"La segunda síndica de Cuautitlán #Izcalli, Ivonne Blanco Calderón, enfatizó que se debe informar puntualmente a la ciudadanía los motivos por los cuales el @GobIzcalli… Checa la nota completa 👇🏻",1517619479567605760,https://bit.ly/3K9KZpr,,,0,0,Twitter for iPhone,3055,1990,37,,11/1/2010,Cuautitlán Izcalli,"Medio de comunicación, prensa, radio http://enfasiscomunicaciones.com",http://enfasiscomunicaciones.com,,View
22/04/2022 16:39,@zeruch124,Señor Don Licenciado Aguilar,"Acabo de ver un carro brandeado con todos los logos de @GobIzcalli en Polanco No quiero creer que vienen de paseo, seguramente están en una misión en extremo importante para nuestro municipio no?",1517619115523022848,,,,0,0,Twitter for Android,813,456,16,,11/13/2009,méxico,"Diseñador, hago fantasy cuando hay tiempo e inspiración. información de libretas personalizadas aquí, buen precio 😌 #miasanmia ⭐⭐⭐⭐⭐",http://zeruchdesign.com,,View
22/04/2022 15:55,@ContinuamosMX,Continuamos Mx,REALIZAN CAMBIOS EN LA ADMINISTRACIÓN MUNICIPAL DE CUAUTITLÁN IZCALLI  #Izcalli #CuautitlánIzcalli @KarlaFiesco @GobIzcalli,1517607944854065155,https://continuamos.mx/?p=35951,,,0,0,Twitter for iPhone,10722,8957,78,,12/27/2010,México,Diario digital; Periodismo libre/plural #Edomex #CDMX c/ Ediciones impresas; en Facebook ContinuamosMx Edición Digital en http://issuu.com/ContinuamosMx,http://www.continuamos.mx,,View
22/04/2022 14:40,@Rubio1089,Alejandro♠,"Drenaje desbordándose en fraccionamiento parque San Mateo municipio de cuautitlán Izcalli , expidiendo olor insoportable y que afecta a decenas de niños que habitan cerca , ninguna autoridad quiere apoyar @alfredodelmazo @GobIzcalli @889Noticias @multimediostv",1517589252103716865,,https://pbs.twimg.com/media/FQ-PYCDXoAA9gRI.jpg,,0,0,Twitter for Android,26,131,0,,9/26/2012,,Lo único imposible es aquello que no intentas,,,View
22/04/2022 14:37,@AlexRub05853689,Alex Rubio,"Drenaje desbordándose en fraccionamiento parque San Mateo municipio de cuautitlán Izcalli , expidiendo olor insoportable y que afecta a decenas de niños que habitan cerca , ninguna autoridad quiere apoyar @alfredodelmazo @GobIzcalli @889Noticias @multimediostv",1517588445765451780,,https://pbs.twimg.com/media/FQ-OpBEXoAQgg7O.jpg,,0,0,Twitter for Android,0,12,0,,11/19/2021,,,,,View
22/04/2022 12:30,@Ej_SanIsidro,Ejidal San Isidro,Favor de revisar y atender @GobIzcalli @KarlaFiesco @SPublicaIzcalli @CMPCyBIzcalli RT @pahox13: @izcaheroes @RicardoNAyala1 @KarlaFiesco Tampoco podan árboles y hay riesgos a casas y vehículos. Solicitamos a proteccion civil acudir a Bolognia 15 aquí en izcalli y hacen caso omiso..Ojalá puedan retwittear. El gobierno anterior al menos atendía las solicitudes. Quien pagará los daños?,1517556337491668993,https://twitter.com/pahox13/status/1517525970307194880,,,0,1,Twitter Web App,554,746,4,,5/2/2019,"Cuautitlán Izcalli, México",#PresaElÁngulo #PlanDeGuadalupe2 #EjidalSanIsidro #VillasDelSol #LosPajaros #AmpliaciónEjidalSanIsidro #Antares #Gaviotas #Mariposas #Huertas #izcalli,,,View
22/04/2022 11:08,@ArturoOscoy,Arturo Contreras,Invita @GobIzcalli a niñas y niños de #Izcalli a ser bomberos por un día 👇🏽,1517535884685430784,https://el-corresponsal.com/invitan-a-ninas-y-ninos-de-izcalli-a-ser-bomberos-por-un-dia/,,,0,0,Twitter for Android,196,774,2,,7/30/2012,Edomex,Trabajando en lo que más me gusta.,http://www.el-corresponsal.com,,View
22/04/2022 09:39,@ObservatorioM19,Observatorio Metropolitano,"#MaltratoAnimal #izcalli #Edomex Por nuestro inbox, nos llegó la denuncia por maltrato animal, esto es calle Libra #4 colonia #ValledelaHacienda, @GobIzcalli @SPublicaIzcalli @KarlaFiesco @SS_Edomex @propaem_sma @MundoPatitas",1517513538411151360,,pic.twitter.com/fzgqCtkp6a,,8,4,Twitter for Android,329,930,5,,6/20/2020,"Cuautitlán Izcalli, México",Periodismo crítico en el Valle de México,,,View
22/04/2022 09:00,@sferaPolitica,Sfera Política,🤝💼 ACERCAN EL PROGRAMA “POSiBLE” A LAS Y LOS EMPRENDEDORES IZCALLENSES @GobIzcalli,1517503494160224256,https://tinyurl.com/2arwh9fa,,,0,0,TweetDeck,7154,1661,86,,11/5/2010,México,"La mejor información, rápida, veraz y confiable de lo que sucede en Acción Nacional http://facebook.com/SferaPolitica",http://www.sferapolitica.com,,View
